<?xml version="1.0" encoding="UTF-8"?>
<cursos xmlns="http://www.instituto.edu/cursos"
        xmlns:cal="http://www.instituto.edu/calendario"
        xmlns:xsi="http://www.w3.org/2001/XMLSchema-instance"
        xsi:schemaLocation="http://www.instituto.edu/cursos cursos.xsd">

    <curso id="CUR001">
        <nombre>Desarrollo Web</nombre>
        <duracion>120</duracion>
        <cal:fechaInicio>2025-10-06</cal:fechaInicio>
        <cal:fechaFin>2026-01-30</cal:fechaFin>
        <modulos>
            <modulo codigo="DWEC01">Desarrollo Web en Entorno Cliente</modulo>
            <modulo codigo="DWES01">Desarrollo Web en Entorno Servidor</modulo>
            <modulo codigo="DAW01">Despliegue de Aplicaciones Web</modulo>
        </modulos>
    </curso>

    <curso id="CUR002">
        <nombre>Cyberseguridad</nombre>
        <duracion>240</duracion>
        <cal:fechaInicio>2025-10-06</cal:fechaInicio>
        <cal:fechaFin>2026-06-30</cal:fechaFin>
        <modulos>
            <modulo codigo="CS01">Fundamentos de Ciberseguridad</modulo>
            <modulo codigo="CS02">Seguridad en Redes</modulo>
            <modulo codigo="CS03">Criptografía</modulo>
            <modulo codigo="CS04">Gestión de Incidentes de Seguridad</modulo>
        </modulos>
    </curso>

</cursos>
